{
	"info": {
		"_postman_id": "cb0a3cf7-cced-4beb-a0da-08fef07aef64",
		"name": "JK Test  V2",
		"schema": "https://schema.getpostman.com/json/collection/v2.1.0/collection.json",
		"_exporter_id": "13668282"
	},
	"item": [
		{
			"name": "Create Auth",
			"request": {
				"method": "POST",
				"header": [
					{
						"key": "Content-Type",
						"value": "application/json"
					}
				],
				"body": {
					"mode": "raw",
					"raw": "{\"username\": \"testuser\", \"password\": \"testpassword\"}",
					"options": {
						"raw": {
							"language": "json"
						}
					}
				},
				"url": {
					"raw": "http://localhost:8000/login/",
					"protocol": "http",
					"host": [
						"localhost"
					],
					"port": "8000",
					"path": [
						"login",
						""
					]
				},
				"description": "Generated from cURL: curl -X POST \"http://localhost:8000/login/\" -H \"Content-Type: application/json\" -d '{\"username\": \"testuser\", \"password\": \"testpassword\"}'\n"
			},
			"response": []
		},
		{
			"name": "Create A Book",
			"request": {
				"method": "POST",
				"header": [
					{
						"key": "Content-Type",
						"value": "application/json"
					},
					{
						"key": "Authorization",
						"value": "Bearer eyJ0eXAiOiJKV1QiLCJhbGciOiJIUzI1NiJ9.eyJzdWIiOiJKS1RFU1QiLCJpYXQiOjE3MjYxMTk4MTMsIm5iZiI6MTcyNjExOTgxMywianRpIjoiY2U3MGJmYzgtNmM2OC00NjFkLWI1YmEtMTEzYjMzMDVjNTU0IiwiZXhwIjoxNzI2MTIwNzEzLCJ0eXBlIjoiYWNjZXNzIiwiZnJlc2giOmZhbHNlfQ.tX7_fDfVmhwwJFCJjKCrPaG7gtPPQXYZ-NQR3IbFN_U",
						"type": "text"
					}
				],
				"body": {
					"mode": "raw",
					"raw": "{\"title\": \"Book Title\", \"author\": \"Author Name\", \"genre\": \"Fiction\", \"year_published\": 2023, \"summary\": \"Sample summary.\"}",
					"options": {
						"raw": {
							"language": "json"
						}
					}
				},
				"url": {
					"raw": "http://localhost:8000/books/",
					"protocol": "http",
					"host": [
						"localhost"
					],
					"port": "8000",
					"path": [
						"books",
						""
					]
				},
				"description": "Generated from cURL: curl -X POST \"http://localhost:8000/books/\" \\\n-H \"Content-Type: application/json\" \\\n-d '{\"title\": \"Book Title\", \"author\": \"Author Name\", \"genre\": \"Fiction\", \"year_published\": 2023, \"summary\": \"Sample summary.\"}'\n"
			},
			"response": [
				{
					"name": "Create A Book",
					"originalRequest": {
						"method": "POST",
						"header": [
							{
								"key": "Content-Type",
								"value": "application/json"
							}
						],
						"body": {
							"mode": "raw",
							"raw": "{\"title\": \"Book Title\", \"author\": \"Author Name\", \"genre\": \"Fiction\", \"year_published\": 2023, \"summary\": \"Sample summary.\"}",
							"options": {
								"raw": {
									"language": "json"
								}
							}
						},
						"url": {
							"raw": "http://localhost:8000/books/",
							"protocol": "http",
							"host": [
								"localhost"
							],
							"port": "8000",
							"path": [
								"books",
								""
							]
						}
					},
					"status": "OK",
					"code": 200,
					"_postman_previewlanguage": "json",
					"header": [
						{
							"key": "date",
							"value": "Thu, 12 Sep 2024 04:51:31 GMT"
						},
						{
							"key": "server",
							"value": "uvicorn"
						},
						{
							"key": "content-length",
							"value": "143"
						},
						{
							"key": "content-type",
							"value": "application/json"
						}
					],
					"cookie": [],
					"body": "{\n    \"id\": 101,\n    \"title\": \"Book Title\",\n    \"author\": \"Author Name\",\n    \"genre\": \"Fiction\",\n    \"year_published\": 2023,\n    \"summary\": \"Sample summary.\",\n    \"average_rating\": 0\n}"
				}
			]
		},
		{
			"name": "Create Book Bulk",
			"request": {
				"method": "POST",
				"header": [
					{
						"key": "Content-Type",
						"value": "application/json"
					}
				],
				"body": {
					"mode": "raw",
					"raw": "'{",
					"options": {
						"raw": {
							"language": "json"
						}
					}
				},
				"url": {
					"raw": "http://localhost:8000/books/bulk",
					"protocol": "http",
					"host": [
						"localhost"
					],
					"port": "8000",
					"path": [
						"books",
						"bulk"
					]
				},
				"description": "Generated from cURL: curl -X POST \"http://localhost:8000/books/bulk\" \\\n-H \"Content-Type: application/json\" \\\n-d \\'{\n    \"books\": [\n        {\n            \"title\": \"Dune\",\n            \"author\": \"Frank Herbert\",\n            \"genre\": \"Sci-Fi\",\n            \"year_published\": 1965,\n            \"summary\": \"A science fiction novel set in a distant future involving political intrigue and a struggle for control of the desert planet Arrakis.\"\n        },\n        {\n            \"title\": \"1984\",\n            \"author\": \"George Orwell\",\n            \"genre\": \"Dystopian\",\n            \"year_published\": 1949,\n            \"summary\": \"A dystopian novel set in a totalitarian society ruled by Big Brother.\"\n        },\n        {\n            \"title\": \"The Hobbit\",\n            \"author\": \"J.R.R. Tolkien\",\n            \"genre\": \"Fantasy\",\n            \"year_published\": 1937,\n            \"summary\": \"A home-loving hobbit embarks on an adventure to reclaim a treasure guarded by a dragon.\"\n        },\n        {\n            \"title\": \"Pride and Prejudice\",\n            \"author\": \"Jane Austen\",\n            \"genre\": \"Romance\",\n            \"year_published\": 1813,\n            \"summary\": \"A romantic novel about the emotional development of Elizabeth Bennet.\"\n        },\n        {\n            \"title\": \"The Catcher in the Rye\",\n            \"author\": \"J.D. Salinger\",\n            \"genre\": \"Literary Fiction\",\n            \"year_published\": 1951,\n            \"summary\": \"A teenage boy's journey through New York after being expelled from his prep school.\"\n        },\n        {\n            \"title\": \"To Kill a Mockingbird\",\n            \"author\": \"Harper Lee\",\n            \"genre\": \"Historical Fiction\",\n            \"year_published\": 1960,\n            \"summary\": \"A young girl in the American South experiences the realities of racism and justice.\"\n        },\n        {\n            \"title\": \"Brave New World\",\n            \"author\": \"Aldous Huxley\",\n            \"genre\": \"Dystopian\",\n            \"year_published\": 1932,\n            \"summary\": \"A dystopian novel set in a future where people are controlled through pleasure and conditioning.\"\n        },\n        {\n            \"title\": \"The Da Vinci Code\",\n            \"author\": \"Dan Brown\",\n            \"genre\": \"Thriller\",\n            \"year_published\": 2003,\n            \"summary\": \"A symbologist and cryptologist uncover secrets protected since the time of Christ.\"\n        },\n        {\n            \"title\": \"Moby-Dick\",\n            \"author\": \"Herman Melville\",\n            \"genre\": \"Adventure\",\n            \"year_published\": 1851,\n            \"summary\": \"A sea captain obsessively pursues a white whale.\"\n        },\n        {\n            \"title\": \"War and Peace\",\n            \"author\": \"Leo Tolstoy\",\n            \"genre\": \"Historical Fiction\",\n            \"year_published\": 1869,\n            \"summary\": \"A sweeping novel about the lives of five aristocratic families during the Napoleonic Wars.\"\n        },\n        {\n            \"title\": \"Crime and Punishment\",\n            \"author\": \"Fyodor Dostoevsky\",\n            \"genre\": \"Psychological Fiction\",\n            \"year_published\": 1866,\n            \"summary\": \"A psychological drama about a man who commits murder and struggles with guilt.\"\n        },\n        {\n            \"title\": \"Frankenstein\",\n            \"author\": \"Mary Shelley\",\n            \"genre\": \"Gothic Fiction\",\n            \"year_published\": 1818,\n            \"summary\": \"A scientist creates a living being, only to be horrified by the result.\"\n        },\n        {\n            \"title\": \"The Great Gatsby\",\n            \"author\": \"F. Scott Fitzgerald\",\n            \"genre\": \"Literary Fiction\",\n            \"year_published\": 1925,\n            \"summary\": \"A mysterious millionaire throws lavish parties in the hopes of reuniting with his lost love.\"\n        },\n        {\n            \"title\": \"Harry Potter and the Sorcerer\\\\'s Stone\",\n            \"author\": \"J.K. Rowling\",\n            \"genre\": \"Fantasy\",\n            \"year_published\": 1997,\n            \"summary\": \"A young boy discovers he is a wizard and attends a magical school.\"\n        },\n        {\n            \"title\": \"The Lord of the Rings\",\n            \"author\": \"J.R.R. Tolkien\",\n            \"genre\": \"Fantasy\",\n            \"year_published\": 1954,\n            \"summary\": \"A fellowship sets out on a quest to destroy a powerful ring.\"\n        },\n        {\n            \"title\": \"The Alchemist\",\n            \"author\": \"Paulo Coelho\",\n            \"genre\": \"Philosophical Fiction\",\n            \"year_published\": 1988,\n            \"summary\": \"A young shepherd sets out on a journey to find his personal legend.\"\n        },\n        {\n            \"title\": \"The Picture of Dorian Gray\",\n            \"author\": \"Oscar Wilde\",\n            \"genre\": \"Gothic Fiction\",\n            \"year_published\": 1890,\n            \"summary\": \"A young man remains youthful while his portrait ages and reveals his corruption.\"\n        },\n        {\n            \"title\": \"Dracula\",\n            \"author\": \"Bram Stoker\",\n            \"genre\": \"Horror\",\n            \"year_published\": 1897,\n            \"summary\": \"A group of people tries to stop a vampire lord from spreading his undead curse.\"\n        },\n        {\n            \"title\": \"Don Quixote\",\n            \"author\": \"Miguel de Cervantes\",\n            \"genre\": \"Adventure\",\n            \"year_published\": 1605,\n            \"summary\": \"A man becomes obsessed with chivalry and sets out to revive knighthood.\"\n        },\n        {\n            \"title\": \"The Road\",\n            \"author\": \"Cormac McCarthy\",\n            \"genre\": \"Post-Apocalyptic\",\n            \"year_published\": 2006,\n            \"summary\": \"A father and son struggle to survive in a post-apocalyptic world.\"\n        },\n        {\n            \"title\": \"Gone with the Wind\",\n            \"author\": \"Margaret Mitchell\",\n            \"genre\": \"Historical Fiction\",\n            \"year_published\": 1936,\n            \"summary\": \"A Southern woman faces hardship during the Civil War and Reconstruction.\"\n        },\n        {\n            \"title\": \"The Kite Runner\",\n            \"author\": \"Khaled Hosseini\",\n            \"genre\": \"Historical Fiction\",\n            \"year_published\": 2003,\n            \"summary\": \"A story of friendship and redemption set against the backdrop of Afghanistan\\'s political turmoil.\"\n        },\n        {\n            \"title\": \"Fahrenheit 451\",\n            \"author\": \"Ray Bradbury\",\n            \"genre\": \"Dystopian\",\n            \"year_published\": 1953,\n            \"summary\": \"A fireman becomes disillusioned with his job of burning books in a future where they are banned.\"\n        },\n        {\n            \"title\": \"The Handmaid\\\\'s Tale\",\n            \"author\": \"Margaret Atwood\",\n            \"genre\": \"Dystopian\",\n            \"year_published\": 1985,\n            \"summary\": \"In a totalitarian society, women are treated as property and forced to bear children.\"\n        },\n        {\n            \"title\": \"Slaughterhouse-Five\",\n            \"author\": \"Kurt Vonnegut\",\n            \"genre\": \"Science Fiction\",\n            \"year_published\": 1969,\n            \"summary\": \"A soldier becomes unstuck in time after surviving the bombing of Dresden.\"\n        },\n        {\n            \"title\": \"The Catch-22\",\n            \"author\": \"Joseph Heller\",\n            \"genre\": \"Satire\",\n            \"year_published\": 1961,\n            \"summary\": \"A bomber pilot in World War II tries to escape the absurdity of war and bureaucracy.\"\n        },\n        {\n            \"title\": \"The Shining\",\n            \"author\": \"Stephen King\",\n            \"genre\": \"Horror\",\n            \"year_published\": 1977,\n            \"summary\": \"A family takes care of a remote hotel, and the father becomes possessed by dark forces.\"\n        },\n        {\n            \"title\": \"Jane Eyre\",\n            \"author\": \"Charlotte Brontë\",\n            \"genre\": \"Romance\",\n            \"year_published\": 1847,\n            \"summary\": \"An orphaned girl becomes a governess and falls in love with her mysterious employer.\"\n        },\n        {\n            \"title\": \"The Grapes of Wrath\",\n            \"author\": \"John Steinbeck\",\n            \"genre\": \"Historical Fiction\",\n            \"year_published\": 1939,\n            \"summary\": \"A poor family flees the Dust Bowl in search of a better life in California.\"\n        },\n        {\n            \"title\": \"The Count of Monte Cristo\",\n            \"author\": \"Alexandre Dumas\",\n            \"genre\": \"Adventure\",\n            \"year_published\": 1844,\n            \"summary\": \"A man escapes from prison and seeks revenge on those who betrayed him.\"\n        },\n        {\n            \"title\": \"A Tale of Two Cities\",\n            \"author\": \"Charles Dickens\",\n            \"genre\": \"Historical Fiction\",\n            \"year_published\": 1859,\n            \"summary\": \"A novel about the French Revolution and the contrasting lives of two men.\"\n        },\n        {\n            \"title\": \"The Stranger\",\n            \"author\": \"Albert Camus\",\n            \"genre\": \"Philosophical Fiction\",\n            \"year_published\": 1942,\n            \"summary\": \"A man becomes detached from society after committing a senseless murder.\"\n        },\n        {\n            \"title\": \"Beloved\",\n            \"author\": \"Toni Morrison\",\n            \"genre\": \"Historical Fiction\",\n            \"year_published\": 1987,\n            \"summary\": \"A former slave is haunted by the ghost of her daughter in post-Civil War America.\"\n        },\n        {\n            \"title\": \"Lolita\",\n            \"author\": \"Vladimir Nabokov\",\n            \"genre\": \"Literary Fiction\",\n            \"year_published\": 1955,\n            \"summary\": \"A middle-aged man becomes obsessed with a twelve-year-old girl.\"\n        },\n        {\n            \"title\": \"The Name of the Wind\",\n            \"author\": \"Patrick Rothfuss\",\n            \"genre\": \"Fantasy\",\n            \"year_published\": 2007,\n            \"summary\": \"A legendary hero recounts his life story in a world of magic and mystery.\"\n        },\n        {\n            \"title\": \"The Girl with the Dragon Tattoo\",\n            \"author\": \"Stieg Larsson\",\n            \"genre\": \"Thriller\",\n            \"year_published\": 2005,\n            \"summary\": \"A journalist and a hacker investigate the disappearance of a wealthy heiress.\"\n        },\n        {\n            \"title\": \"The Hunger Games\",\n            \"author\": \"Suzanne Collins\",\n            \"genre\": \"Dystopian\",\n            \"year_published\": 2008,\n            \"summary\": \"A girl must compete in a deadly televised contest where only one person can survive.\"\n        },\n        {\n            \"title\": \"The Fault in Our Stars\",\n            \"author\": \"John Green\",\n            \"genre\": \"Romance\",\n            \"year_published\": 2012,\n            \"summary\": \"Two teenagers with terminal cancer form a life-changing bond.\"\n        },\n        {\n            \"title\": \"Ulysses\",\n            \"author\": \"James Joyce\",\n            \"genre\": \"Modernist Fiction\",\n            \"year_published\": 1922,\n            \"summary\": \"A day in the life of an ordinary man in Dublin, modeled after Homer\\'s Odyssey.\"\n        },\n        {\n            \"title\": \"The Brothers Karamazov\",\n            \"author\": \"Fyodor Dostoevsky\",\n            \"genre\": \"Philosophical Fiction\",\n            \"year_published\": 1880,\n            \"summary\": \"A murder mystery that explores themes of faith, free will, and morality.\"\n        },\n        {\n            \"title\": \"Wuthering Heights\",\n            \"author\": \"Emily Brontë\",\n            \"genre\": \"Gothic Fiction\",\n            \"year_published\": 1847,\n            \"summary\": \"A tale of passionate love and revenge set on the Yorkshire moors.\"\n        },\n        {\n            \"title\": \"The Odyssey\",\n            \"author\": \"Homer\",\n            \"genre\": \"Epic Poetry\",\n            \"year_published\": \"8th Century BC\",\n            \"summary\": \"The story of Odysseus\\'s long journey home after the Trojan War.\"\n        },\n        {\n            \"title\": \"Les Misérables\",\n            \"author\": \"Victor Hugo\",\n            \"genre\": \"Historical Fiction\",\n            \"year_published\": 1862,\n            \"summary\": \"A man seeks redemption in post-revolutionary France while being pursued by a relentless policeman.\"\n        },\n        {\n            \"title\": \"The Secret History\",\n            \"author\": \"Donna Tartt\",\n            \"genre\": \"Thriller\",\n            \"year_published\": 1992,\n            \"summary\": \"A group of elite students at a private college become involved in a murder.\"\n        },\n        {\n            \"title\": \"The Stand\",\n            \"author\": \"Stephen King\",\n            \"genre\": \"Post-Apocalyptic\",\n            \"year_published\": 1978,\n            \"summary\": \"After a plague wipes out most of the population, the survivors must choose between good and evil.\"\n        },\n        {\n            \"title\": \"Anna Karenina\",\n            \"author\": \"Leo Tolstoy\",\n            \"genre\": \"Literary Fiction\",\n            \"year_published\": 1877,\n            \"summary\": \"A tragic story of love and infidelity among the Russian aristocracy.\"\n        },\n        {\n            \"title\": \"Rebecca\",\n            \"author\": \"Daphne du Maurier\",\n            \"genre\": \"Gothic Fiction\",\n            \"year_published\": 1938,\n            \"summary\": \"A young bride is haunted by the memory of her husband\\'s first wife.\"\n        }\n    ]\n}'\n"
			},
			"response": [
				{
					"name": "http://localhost:8000/books/bulk",
					"originalRequest": {
						"method": "POST",
						"header": [
							{
								"key": "Content-Type",
								"value": "application/json"
							}
						],
						"body": {
							"mode": "raw",
							"raw": "{\n    \"books\": [\n        {\n            \"title\": \"Dune\",\n            \"author\": \"Frank Herbert\",\n            \"genre\": \"Sci-Fi\",\n            \"year_published\": 1965,\n            \"summary\": \"A science fiction novel set in a distant future involving political intrigue and a struggle for control of the desert planet Arrakis.\"\n        },\n        {\n            \"title\": \"1984\",\n            \"author\": \"George Orwell\",\n            \"genre\": \"Dystopian\",\n            \"year_published\": 1949,\n            \"summary\": \"A dystopian novel set in a totalitarian society ruled by Big Brother.\"\n        },\n        {\n            \"title\": \"The Hobbit\",\n            \"author\": \"J.R.R. Tolkien\",\n            \"genre\": \"Fantasy\",\n            \"year_published\": 1937,\n            \"summary\": \"A home-loving hobbit embarks on an adventure to reclaim a treasure guarded by a dragon.\"\n        },\n        {\n            \"title\": \"Pride and Prejudice\",\n            \"author\": \"Jane Austen\",\n            \"genre\": \"Romance\",\n            \"year_published\": 1813,\n            \"summary\": \"A romantic novel about the emotional development of Elizabeth Bennet.\"\n        },\n        {\n            \"title\": \"The Catcher in the Rye\",\n            \"author\": \"J.D. Salinger\",\n            \"genre\": \"Literary Fiction\",\n            \"year_published\": 1951,\n            \"summary\": \"A teenage boy's journey through New York after being expelled from his prep school.\"\n        },\n        {\n            \"title\": \"To Kill a Mockingbird\",\n            \"author\": \"Harper Lee\",\n            \"genre\": \"Historical Fiction\",\n            \"year_published\": 1960,\n            \"summary\": \"A young girl in the American South experiences the realities of racism and justice.\"\n        },\n        {\n            \"title\": \"Brave New World\",\n            \"author\": \"Aldous Huxley\",\n            \"genre\": \"Dystopian\",\n            \"year_published\": 1932,\n            \"summary\": \"A dystopian novel set in a future where people are controlled through pleasure and conditioning.\"\n        },\n        {\n            \"title\": \"The Da Vinci Code\",\n            \"author\": \"Dan Brown\",\n            \"genre\": \"Thriller\",\n            \"year_published\": 2003,\n            \"summary\": \"A symbologist and cryptologist uncover secrets protected since the time of Christ.\"\n        },\n        {\n            \"title\": \"Moby-Dick\",\n            \"author\": \"Herman Melville\",\n            \"genre\": \"Adventure\",\n            \"year_published\": 1851,\n            \"summary\": \"A sea captain obsessively pursues a white whale.\"\n        },\n        {\n            \"title\": \"War and Peace\",\n            \"author\": \"Leo Tolstoy\",\n            \"genre\": \"Historical Fiction\",\n            \"year_published\": 1869,\n            \"summary\": \"A sweeping novel about the lives of five aristocratic families during the Napoleonic Wars.\"\n        },\n        {\n            \"title\": \"Crime and Punishment\",\n            \"author\": \"Fyodor Dostoevsky\",\n            \"genre\": \"Psychological Fiction\",\n            \"year_published\": 1866,\n            \"summary\": \"A psychological drama about a man who commits murder and struggles with guilt.\"\n        },\n        {\n            \"title\": \"Frankenstein\",\n            \"author\": \"Mary Shelley\",\n            \"genre\": \"Gothic Fiction\",\n            \"year_published\": 1818,\n            \"summary\": \"A scientist creates a living being, only to be horrified by the result.\"\n        },\n        {\n            \"title\": \"The Great Gatsby\",\n            \"author\": \"F. Scott Fitzgerald\",\n            \"genre\": \"Literary Fiction\",\n            \"year_published\": 1925,\n            \"summary\": \"A mysterious millionaire throws lavish parties in the hopes of reuniting with his lost love.\"\n        },\n        {\n            \"title\": \"Harry Potter and the Sorcerer\\\\'s Stone\",\n            \"author\": \"J.K. Rowling\",\n            \"genre\": \"Fantasy\",\n            \"year_published\": 1997,\n            \"summary\": \"A young boy discovers he is a wizard and attends a magical school.\"\n        },\n        {\n            \"title\": \"The Lord of the Rings\",\n            \"author\": \"J.R.R. Tolkien\",\n            \"genre\": \"Fantasy\",\n            \"year_published\": 1954,\n            \"summary\": \"A fellowship sets out on a quest to destroy a powerful ring.\"\n        },\n        {\n            \"title\": \"The Alchemist\",\n            \"author\": \"Paulo Coelho\",\n            \"genre\": \"Philosophical Fiction\",\n            \"year_published\": 1988,\n            \"summary\": \"A young shepherd sets out on a journey to find his personal legend.\"\n        },\n        {\n            \"title\": \"The Picture of Dorian Gray\",\n            \"author\": \"Oscar Wilde\",\n            \"genre\": \"Gothic Fiction\",\n            \"year_published\": 1890,\n            \"summary\": \"A young man remains youthful while his portrait ages and reveals his corruption.\"\n        },\n        {\n            \"title\": \"Dracula\",\n            \"author\": \"Bram Stoker\",\n            \"genre\": \"Horror\",\n            \"year_published\": 1897,\n            \"summary\": \"A group of people tries to stop a vampire lord from spreading his undead curse.\"\n        },\n        {\n            \"title\": \"Don Quixote\",\n            \"author\": \"Miguel de Cervantes\",\n            \"genre\": \"Adventure\",\n            \"year_published\": 1605,\n            \"summary\": \"A man becomes obsessed with chivalry and sets out to revive knighthood.\"\n        },\n        {\n            \"title\": \"The Road\",\n            \"author\": \"Cormac McCarthy\",\n            \"genre\": \"Post-Apocalyptic\",\n            \"year_published\": 2006,\n            \"summary\": \"A father and son struggle to survive in a post-apocalyptic world.\"\n        },\n        {\n            \"title\": \"Gone with the Wind\",\n            \"author\": \"Margaret Mitchell\",\n            \"genre\": \"Historical Fiction\",\n            \"year_published\": 1936,\n            \"summary\": \"A Southern woman faces hardship during the Civil War and Reconstruction.\"\n        },\n        {\n            \"title\": \"The Kite Runner\",\n            \"author\": \"Khaled Hosseini\",\n            \"genre\": \"Historical Fiction\",\n            \"year_published\": 2003,\n            \"summary\": \"A story of friendship and redemption set against the backdrop of Afghanistan political turmoil.\"\n        },\n        {\n            \"title\": \"Fahrenheit 451\",\n            \"author\": \"Ray Bradbury\",\n            \"genre\": \"Dystopian\",\n            \"year_published\": 1953,\n            \"summary\": \"A fireman becomes disillusioned with his job of burning books in a future where they are banned.\"\n        },\n        {\n            \"title\": \"The Handmaid\\\\'s Tale\",\n            \"author\": \"Margaret Atwood\",\n            \"genre\": \"Dystopian\",\n            \"year_published\": 1985,\n            \"summary\": \"In a totalitarian society, women are treated as property and forced to bear children.\"\n        },\n        {\n            \"title\": \"Slaughterhouse-Five\",\n            \"author\": \"Kurt Vonnegut\",\n            \"genre\": \"Science Fiction\",\n            \"year_published\": 1969,\n            \"summary\": \"A soldier becomes unstuck in time after surviving the bombing of Dresden.\"\n        },\n        {\n            \"title\": \"The Catch-22\",\n            \"author\": \"Joseph Heller\",\n            \"genre\": \"Satire\",\n            \"year_published\": 1961,\n            \"summary\": \"A bomber pilot in World War II tries to escape the absurdity of war and bureaucracy.\"\n        },\n        {\n            \"title\": \"The Shining\",\n            \"author\": \"Stephen King\",\n            \"genre\": \"Horror\",\n            \"year_published\": 1977,\n            \"summary\": \"A family takes care of a remote hotel, and the father becomes possessed by dark forces.\"\n        },\n        {\n            \"title\": \"Jane Eyre\",\n            \"author\": \"Charlotte Brontë\",\n            \"genre\": \"Romance\",\n            \"year_published\": 1847,\n            \"summary\": \"An orphaned girl becomes a governess and falls in love with her mysterious employer.\"\n        },\n        {\n            \"title\": \"The Grapes of Wrath\",\n            \"author\": \"John Steinbeck\",\n            \"genre\": \"Historical Fiction\",\n            \"year_published\": 1939,\n            \"summary\": \"A poor family flees the Dust Bowl in search of a better life in California.\"\n        },\n        {\n            \"title\": \"The Count of Monte Cristo\",\n            \"author\": \"Alexandre Dumas\",\n            \"genre\": \"Adventure\",\n            \"year_published\": 1844,\n            \"summary\": \"A man escapes from prison and seeks revenge on those who betrayed him.\"\n        },\n        {\n            \"title\": \"A Tale of Two Cities\",\n            \"author\": \"Charles Dickens\",\n            \"genre\": \"Historical Fiction\",\n            \"year_published\": 1859,\n            \"summary\": \"A novel about the French Revolution and the contrasting lives of two men.\"\n        },\n        {\n            \"title\": \"The Stranger\",\n            \"author\": \"Albert Camus\",\n            \"genre\": \"Philosophical Fiction\",\n            \"year_published\": 1942,\n            \"summary\": \"A man becomes detached from society after committing a senseless murder.\"\n        },\n        {\n            \"title\": \"Beloved\",\n            \"author\": \"Toni Morrison\",\n            \"genre\": \"Historical Fiction\",\n            \"year_published\": 1987,\n            \"summary\": \"A former slave is haunted by the ghost of her daughter in post-Civil War America.\"\n        },\n        {\n            \"title\": \"Lolita\",\n            \"author\": \"Vladimir Nabokov\",\n            \"genre\": \"Literary Fiction\",\n            \"year_published\": 1955,\n            \"summary\": \"A middle-aged man becomes obsessed with a twelve-year-old girl.\"\n        },\n        {\n            \"title\": \"The Name of the Wind\",\n            \"author\": \"Patrick Rothfuss\",\n            \"genre\": \"Fantasy\",\n            \"year_published\": 2007,\n            \"summary\": \"A legendary hero recounts his life story in a world of magic and mystery.\"\n        },\n        {\n            \"title\": \"The Girl with the Dragon Tattoo\",\n            \"author\": \"Stieg Larsson\",\n            \"genre\": \"Thriller\",\n            \"year_published\": 2005,\n            \"summary\": \"A journalist and a hacker investigate the disappearance of a wealthy heiress.\"\n        },\n        {\n            \"title\": \"The Hunger Games\",\n            \"author\": \"Suzanne Collins\",\n            \"genre\": \"Dystopian\",\n            \"year_published\": 2008,\n            \"summary\": \"A girl must compete in a deadly televised contest where only one person can survive.\"\n        },\n        {\n            \"title\": \"The Fault in Our Stars\",\n            \"author\": \"John Green\",\n            \"genre\": \"Romance\",\n            \"year_published\": 2012,\n            \"summary\": \"Two teenagers with terminal cancer form a life-changing bond.\"\n        },\n        {\n            \"title\": \"Ulysses\",\n            \"author\": \"James Joyce\",\n            \"genre\": \"Modernist Fiction\",\n            \"year_published\": 1922,\n            \"summary\": \"A day in the life of an ordinary man in Dublin, modeled after Homer's Odyssey.\"\n        },\n        {\n            \"title\": \"The Brothers Karamazov\",\n            \"author\": \"Fyodor Dostoevsky\",\n            \"genre\": \"Philosophical Fiction\",\n            \"year_published\": 1880,\n            \"summary\": \"A murder mystery that explores themes of faith, free will, and morality.\"\n        },\n        {\n            \"title\": \"Wuthering Heights\",\n            \"author\": \"Emily Brontë\",\n            \"genre\": \"Gothic Fiction\",\n            \"year_published\": 1847,\n            \"summary\": \"A tale of passionate love and revenge set on the Yorkshire moors.\"\n        },\n        {\n            \"title\": \"The Odyssey\",\n            \"author\": \"Homer\",\n            \"genre\": \"Epic Poetry\",\n            \"year_published\": 1847,\n            \"summary\": \"The story of Odysseus's long journey home after the Trojan War.\"\n        },\n        {\n            \"title\": \"Les Misérables\",\n            \"author\": \"Victor Hugo\",\n            \"genre\": \"Historical Fiction\",\n            \"year_published\": 1862,\n            \"summary\": \"A man seeks redemption in post-revolutionary France while being pursued by a relentless policeman.\"\n        },\n        {\n            \"title\": \"The Secret History\",\n            \"author\": \"Donna Tartt\",\n            \"genre\": \"Thriller\",\n            \"year_published\": 1992,\n            \"summary\": \"A group of elite students at a private college become involved in a murder.\"\n        },\n        {\n            \"title\": \"The Stand\",\n            \"author\": \"Stephen King\",\n            \"genre\": \"Post-Apocalyptic\",\n            \"year_published\": 1978,\n            \"summary\": \"After a plague wipes out most of the population, the survivors must choose between good and evil.\"\n        },\n        {\n            \"title\": \"Anna Karenina\",\n            \"author\": \"Leo Tolstoy\",\n            \"genre\": \"Literary Fiction\",\n            \"year_published\": 1877,\n            \"summary\": \"A tragic story of love and infidelity among the Russian aristocracy.\"\n        },\n        {\n            \"title\": \"Rebecca\",\n            \"author\": \"Daphne du Maurier\",\n            \"genre\": \"Gothic Fiction\",\n            \"year_published\": 1938,\n            \"summary\": \"A young bride is haunted by the memory of her husband's first wife.\"\n        }\n    ]\n}\n",
							"options": {
								"raw": {
									"language": "json"
								}
							}
						},
						"url": {
							"raw": "http://localhost:8000/books/bulk",
							"protocol": "http",
							"host": [
								"localhost"
							],
							"port": "8000",
							"path": [
								"books",
								"bulk"
							]
						}
					},
					"status": "OK",
					"code": 200,
					"_postman_previewlanguage": "json",
					"header": [
						{
							"key": "date",
							"value": "Thu, 12 Sep 2024 03:49:34 GMT"
						},
						{
							"key": "server",
							"value": "uvicorn"
						},
						{
							"key": "content-length",
							"value": "10294"
						},
						{
							"key": "content-type",
							"value": "application/json"
						}
					],
					"cookie": [],
					"body": "[\n    {\n        \"id\": 6,\n        \"title\": \"Dune\",\n        \"author\": \"Frank Herbert\",\n        \"genre\": \"Sci-Fi\",\n        \"year_published\": 1965,\n        \"summary\": \"A science fiction novel set in a distant future involving political intrigue and a struggle for control of the desert planet Arrakis.\",\n        \"average_rating\": 0\n    },\n    {\n        \"id\": 7,\n        \"title\": \"1984\",\n        \"author\": \"George Orwell\",\n        \"genre\": \"Dystopian\",\n        \"year_published\": 1949,\n        \"summary\": \"A dystopian novel set in a totalitarian society ruled by Big Brother.\",\n        \"average_rating\": 0\n    },\n    {\n        \"id\": 8,\n        \"title\": \"The Hobbit\",\n        \"author\": \"J.R.R. Tolkien\",\n        \"genre\": \"Fantasy\",\n        \"year_published\": 1937,\n        \"summary\": \"A home-loving hobbit embarks on an adventure to reclaim a treasure guarded by a dragon.\",\n        \"average_rating\": 0\n    },\n    {\n        \"id\": 9,\n        \"title\": \"Pride and Prejudice\",\n        \"author\": \"Jane Austen\",\n        \"genre\": \"Romance\",\n        \"year_published\": 1813,\n        \"summary\": \"A romantic novel about the emotional development of Elizabeth Bennet.\",\n        \"average_rating\": 0\n    },\n    {\n        \"id\": 10,\n        \"title\": \"The Catcher in the Rye\",\n        \"author\": \"J.D. Salinger\",\n        \"genre\": \"Literary Fiction\",\n        \"year_published\": 1951,\n        \"summary\": \"A teenage boy's journey through New York after being expelled from his prep school.\",\n        \"average_rating\": 0\n    },\n    {\n        \"id\": 11,\n        \"title\": \"To Kill a Mockingbird\",\n        \"author\": \"Harper Lee\",\n        \"genre\": \"Historical Fiction\",\n        \"year_published\": 1960,\n        \"summary\": \"A young girl in the American South experiences the realities of racism and justice.\",\n        \"average_rating\": 0\n    },\n    {\n        \"id\": 12,\n        \"title\": \"Brave New World\",\n        \"author\": \"Aldous Huxley\",\n        \"genre\": \"Dystopian\",\n        \"year_published\": 1932,\n        \"summary\": \"A dystopian novel set in a future where people are controlled through pleasure and conditioning.\",\n        \"average_rating\": 0\n    },\n    {\n        \"id\": 13,\n        \"title\": \"The Da Vinci Code\",\n        \"author\": \"Dan Brown\",\n        \"genre\": \"Thriller\",\n        \"year_published\": 2003,\n        \"summary\": \"A symbologist and cryptologist uncover secrets protected since the time of Christ.\",\n        \"average_rating\": 0\n    },\n    {\n        \"id\": 14,\n        \"title\": \"Moby-Dick\",\n        \"author\": \"Herman Melville\",\n        \"genre\": \"Adventure\",\n        \"year_published\": 1851,\n        \"summary\": \"A sea captain obsessively pursues a white whale.\",\n        \"average_rating\": 0\n    },\n    {\n        \"id\": 15,\n        \"title\": \"War and Peace\",\n        \"author\": \"Leo Tolstoy\",\n        \"genre\": \"Historical Fiction\",\n        \"year_published\": 1869,\n        \"summary\": \"A sweeping novel about the lives of five aristocratic families during the Napoleonic Wars.\",\n        \"average_rating\": 0\n    },\n    {\n        \"id\": 16,\n        \"title\": \"Crime and Punishment\",\n        \"author\": \"Fyodor Dostoevsky\",\n        \"genre\": \"Psychological Fiction\",\n        \"year_published\": 1866,\n        \"summary\": \"A psychological drama about a man who commits murder and struggles with guilt.\",\n        \"average_rating\": 0\n    },\n    {\n        \"id\": 17,\n        \"title\": \"Frankenstein\",\n        \"author\": \"Mary Shelley\",\n        \"genre\": \"Gothic Fiction\",\n        \"year_published\": 1818,\n        \"summary\": \"A scientist creates a living being, only to be horrified by the result.\",\n        \"average_rating\": 0\n    },\n    {\n        \"id\": 18,\n        \"title\": \"The Great Gatsby\",\n        \"author\": \"F. Scott Fitzgerald\",\n        \"genre\": \"Literary Fiction\",\n        \"year_published\": 1925,\n        \"summary\": \"A mysterious millionaire throws lavish parties in the hopes of reuniting with his lost love.\",\n        \"average_rating\": 0\n    },\n    {\n        \"id\": 19,\n        \"title\": \"Harry Potter and the Sorcerer\\\\'s Stone\",\n        \"author\": \"J.K. Rowling\",\n        \"genre\": \"Fantasy\",\n        \"year_published\": 1997,\n        \"summary\": \"A young boy discovers he is a wizard and attends a magical school.\",\n        \"average_rating\": 0\n    },\n    {\n        \"id\": 20,\n        \"title\": \"The Lord of the Rings\",\n        \"author\": \"J.R.R. Tolkien\",\n        \"genre\": \"Fantasy\",\n        \"year_published\": 1954,\n        \"summary\": \"A fellowship sets out on a quest to destroy a powerful ring.\",\n        \"average_rating\": 0\n    },\n    {\n        \"id\": 21,\n        \"title\": \"The Alchemist\",\n        \"author\": \"Paulo Coelho\",\n        \"genre\": \"Philosophical Fiction\",\n        \"year_published\": 1988,\n        \"summary\": \"A young shepherd sets out on a journey to find his personal legend.\",\n        \"average_rating\": 0\n    },\n    {\n        \"id\": 22,\n        \"title\": \"The Picture of Dorian Gray\",\n        \"author\": \"Oscar Wilde\",\n        \"genre\": \"Gothic Fiction\",\n        \"year_published\": 1890,\n        \"summary\": \"A young man remains youthful while his portrait ages and reveals his corruption.\",\n        \"average_rating\": 0\n    },\n    {\n        \"id\": 23,\n        \"title\": \"Dracula\",\n        \"author\": \"Bram Stoker\",\n        \"genre\": \"Horror\",\n        \"year_published\": 1897,\n        \"summary\": \"A group of people tries to stop a vampire lord from spreading his undead curse.\",\n        \"average_rating\": 0\n    },\n    {\n        \"id\": 24,\n        \"title\": \"Don Quixote\",\n        \"author\": \"Miguel de Cervantes\",\n        \"genre\": \"Adventure\",\n        \"year_published\": 1605,\n        \"summary\": \"A man becomes obsessed with chivalry and sets out to revive knighthood.\",\n        \"average_rating\": 0\n    },\n    {\n        \"id\": 25,\n        \"title\": \"The Road\",\n        \"author\": \"Cormac McCarthy\",\n        \"genre\": \"Post-Apocalyptic\",\n        \"year_published\": 2006,\n        \"summary\": \"A father and son struggle to survive in a post-apocalyptic world.\",\n        \"average_rating\": 0\n    },\n    {\n        \"id\": 26,\n        \"title\": \"Gone with the Wind\",\n        \"author\": \"Margaret Mitchell\",\n        \"genre\": \"Historical Fiction\",\n        \"year_published\": 1936,\n        \"summary\": \"A Southern woman faces hardship during the Civil War and Reconstruction.\",\n        \"average_rating\": 0\n    },\n    {\n        \"id\": 27,\n        \"title\": \"The Kite Runner\",\n        \"author\": \"Khaled Hosseini\",\n        \"genre\": \"Historical Fiction\",\n        \"year_published\": 2003,\n        \"summary\": \"A story of friendship and redemption set against the backdrop of Afghanistan political turmoil.\",\n        \"average_rating\": 0\n    },\n    {\n        \"id\": 28,\n        \"title\": \"Fahrenheit 451\",\n        \"author\": \"Ray Bradbury\",\n        \"genre\": \"Dystopian\",\n        \"year_published\": 1953,\n        \"summary\": \"A fireman becomes disillusioned with his job of burning books in a future where they are banned.\",\n        \"average_rating\": 0\n    },\n    {\n        \"id\": 29,\n        \"title\": \"The Handmaid\\\\'s Tale\",\n        \"author\": \"Margaret Atwood\",\n        \"genre\": \"Dystopian\",\n        \"year_published\": 1985,\n        \"summary\": \"In a totalitarian society, women are treated as property and forced to bear children.\",\n        \"average_rating\": 0\n    },\n    {\n        \"id\": 30,\n        \"title\": \"Slaughterhouse-Five\",\n        \"author\": \"Kurt Vonnegut\",\n        \"genre\": \"Science Fiction\",\n        \"year_published\": 1969,\n        \"summary\": \"A soldier becomes unstuck in time after surviving the bombing of Dresden.\",\n        \"average_rating\": 0\n    },\n    {\n        \"id\": 31,\n        \"title\": \"The Catch-22\",\n        \"author\": \"Joseph Heller\",\n        \"genre\": \"Satire\",\n        \"year_published\": 1961,\n        \"summary\": \"A bomber pilot in World War II tries to escape the absurdity of war and bureaucracy.\",\n        \"average_rating\": 0\n    },\n    {\n        \"id\": 32,\n        \"title\": \"The Shining\",\n        \"author\": \"Stephen King\",\n        \"genre\": \"Horror\",\n        \"year_published\": 1977,\n        \"summary\": \"A family takes care of a remote hotel, and the father becomes possessed by dark forces.\",\n        \"average_rating\": 0\n    },\n    {\n        \"id\": 33,\n        \"title\": \"Jane Eyre\",\n        \"author\": \"Charlotte Brontë\",\n        \"genre\": \"Romance\",\n        \"year_published\": 1847,\n        \"summary\": \"An orphaned girl becomes a governess and falls in love with her mysterious employer.\",\n        \"average_rating\": 0\n    },\n    {\n        \"id\": 34,\n        \"title\": \"The Grapes of Wrath\",\n        \"author\": \"John Steinbeck\",\n        \"genre\": \"Historical Fiction\",\n        \"year_published\": 1939,\n        \"summary\": \"A poor family flees the Dust Bowl in search of a better life in California.\",\n        \"average_rating\": 0\n    },\n    {\n        \"id\": 35,\n        \"title\": \"The Count of Monte Cristo\",\n        \"author\": \"Alexandre Dumas\",\n        \"genre\": \"Adventure\",\n        \"year_published\": 1844,\n        \"summary\": \"A man escapes from prison and seeks revenge on those who betrayed him.\",\n        \"average_rating\": 0\n    },\n    {\n        \"id\": 36,\n        \"title\": \"A Tale of Two Cities\",\n        \"author\": \"Charles Dickens\",\n        \"genre\": \"Historical Fiction\",\n        \"year_published\": 1859,\n        \"summary\": \"A novel about the French Revolution and the contrasting lives of two men.\",\n        \"average_rating\": 0\n    },\n    {\n        \"id\": 37,\n        \"title\": \"The Stranger\",\n        \"author\": \"Albert Camus\",\n        \"genre\": \"Philosophical Fiction\",\n        \"year_published\": 1942,\n        \"summary\": \"A man becomes detached from society after committing a senseless murder.\",\n        \"average_rating\": 0\n    },\n    {\n        \"id\": 38,\n        \"title\": \"Beloved\",\n        \"author\": \"Toni Morrison\",\n        \"genre\": \"Historical Fiction\",\n        \"year_published\": 1987,\n        \"summary\": \"A former slave is haunted by the ghost of her daughter in post-Civil War America.\",\n        \"average_rating\": 0\n    },\n    {\n        \"id\": 39,\n        \"title\": \"Lolita\",\n        \"author\": \"Vladimir Nabokov\",\n        \"genre\": \"Literary Fiction\",\n        \"year_published\": 1955,\n        \"summary\": \"A middle-aged man becomes obsessed with a twelve-year-old girl.\",\n        \"average_rating\": 0\n    },\n    {\n        \"id\": 40,\n        \"title\": \"The Name of the Wind\",\n        \"author\": \"Patrick Rothfuss\",\n        \"genre\": \"Fantasy\",\n        \"year_published\": 2007,\n        \"summary\": \"A legendary hero recounts his life story in a world of magic and mystery.\",\n        \"average_rating\": 0\n    },\n    {\n        \"id\": 41,\n        \"title\": \"The Girl with the Dragon Tattoo\",\n        \"author\": \"Stieg Larsson\",\n        \"genre\": \"Thriller\",\n        \"year_published\": 2005,\n        \"summary\": \"A journalist and a hacker investigate the disappearance of a wealthy heiress.\",\n        \"average_rating\": 0\n    },\n    {\n        \"id\": 42,\n        \"title\": \"The Hunger Games\",\n        \"author\": \"Suzanne Collins\",\n        \"genre\": \"Dystopian\",\n        \"year_published\": 2008,\n        \"summary\": \"A girl must compete in a deadly televised contest where only one person can survive.\",\n        \"average_rating\": 0\n    },\n    {\n        \"id\": 43,\n        \"title\": \"The Fault in Our Stars\",\n        \"author\": \"John Green\",\n        \"genre\": \"Romance\",\n        \"year_published\": 2012,\n        \"summary\": \"Two teenagers with terminal cancer form a life-changing bond.\",\n        \"average_rating\": 0\n    },\n    {\n        \"id\": 44,\n        \"title\": \"Ulysses\",\n        \"author\": \"James Joyce\",\n        \"genre\": \"Modernist Fiction\",\n        \"year_published\": 1922,\n        \"summary\": \"A day in the life of an ordinary man in Dublin, modeled after Homer's Odyssey.\",\n        \"average_rating\": 0\n    },\n    {\n        \"id\": 45,\n        \"title\": \"The Brothers Karamazov\",\n        \"author\": \"Fyodor Dostoevsky\",\n        \"genre\": \"Philosophical Fiction\",\n        \"year_published\": 1880,\n        \"summary\": \"A murder mystery that explores themes of faith, free will, and morality.\",\n        \"average_rating\": 0\n    },\n    {\n        \"id\": 46,\n        \"title\": \"Wuthering Heights\",\n        \"author\": \"Emily Brontë\",\n        \"genre\": \"Gothic Fiction\",\n        \"year_published\": 1847,\n        \"summary\": \"A tale of passionate love and revenge set on the Yorkshire moors.\",\n        \"average_rating\": 0\n    },\n    {\n        \"id\": 47,\n        \"title\": \"The Odyssey\",\n        \"author\": \"Homer\",\n        \"genre\": \"Epic Poetry\",\n        \"year_published\": 1847,\n        \"summary\": \"The story of Odysseus's long journey home after the Trojan War.\",\n        \"average_rating\": 0\n    },\n    {\n        \"id\": 48,\n        \"title\": \"Les Misérables\",\n        \"author\": \"Victor Hugo\",\n        \"genre\": \"Historical Fiction\",\n        \"year_published\": 1862,\n        \"summary\": \"A man seeks redemption in post-revolutionary France while being pursued by a relentless policeman.\",\n        \"average_rating\": 0\n    },\n    {\n        \"id\": 49,\n        \"title\": \"The Secret History\",\n        \"author\": \"Donna Tartt\",\n        \"genre\": \"Thriller\",\n        \"year_published\": 1992,\n        \"summary\": \"A group of elite students at a private college become involved in a murder.\",\n        \"average_rating\": 0\n    },\n    {\n        \"id\": 50,\n        \"title\": \"The Stand\",\n        \"author\": \"Stephen King\",\n        \"genre\": \"Post-Apocalyptic\",\n        \"year_published\": 1978,\n        \"summary\": \"After a plague wipes out most of the population, the survivors must choose between good and evil.\",\n        \"average_rating\": 0\n    },\n    {\n        \"id\": 51,\n        \"title\": \"Anna Karenina\",\n        \"author\": \"Leo Tolstoy\",\n        \"genre\": \"Literary Fiction\",\n        \"year_published\": 1877,\n        \"summary\": \"A tragic story of love and infidelity among the Russian aristocracy.\",\n        \"average_rating\": 0\n    },\n    {\n        \"id\": 52,\n        \"title\": \"Rebecca\",\n        \"author\": \"Daphne du Maurier\",\n        \"genre\": \"Gothic Fiction\",\n        \"year_published\": 1938,\n        \"summary\": \"A young bride is haunted by the memory of her husband's first wife.\",\n        \"average_rating\": 0\n    }\n]"
				}
			]
		},
		{
			"name": "Get All Books",
			"request": {
				"method": "GET",
				"header": [],
				"url": {
					"raw": "http://localhost:8000/books/",
					"protocol": "http",
					"host": [
						"localhost"
					],
					"port": "8000",
					"path": [
						"books",
						""
					]
				},
				"description": "Generated from cURL: curl -X GET \"http://localhost:8000/books/\"\n"
			},
			"response": [
				{
					"name": "Get All Books",
					"originalRequest": {
						"method": "GET",
						"header": [],
						"url": {
							"raw": "http://localhost:8000/books/",
							"protocol": "http",
							"host": [
								"localhost"
							],
							"port": "8000",
							"path": [
								"books",
								""
							]
						}
					},
					"status": "OK",
					"code": 200,
					"_postman_previewlanguage": "json",
					"header": [
						{
							"key": "date",
							"value": "Thu, 12 Sep 2024 03:53:14 GMT"
						},
						{
							"key": "server",
							"value": "uvicorn"
						},
						{
							"key": "content-length",
							"value": "11554"
						},
						{
							"key": "content-type",
							"value": "application/json"
						}
					],
					"cookie": [],
					"body": "[\n    {\n        \"id\": 1,\n        \"title\": \"Dune\",\n        \"author\": \"Frank Herbert\",\n        \"genre\": \"Sci-Fi\",\n        \"year_published\": 1965,\n        \"summary\": \"Set on the desert planet Arrakis, Dune tells the story of a young boy, Paul Atreides, whose family accepts control of the desert planet.\",\n        \"average_rating\": 0\n    },\n    {\n        \"id\": 2,\n        \"title\": \"The Hobbit\",\n        \"author\": \"J.R.R. Tolkien\",\n        \"genre\": \"Fantasy\",\n        \"year_published\": 1937,\n        \"summary\": \"The story follows the quest of home-loving Bilbo Baggins to win a share of the treasure guarded by Smaug the dragon.\",\n        \"average_rating\": 0\n    },\n    {\n        \"id\": 3,\n        \"title\": \"1984\",\n        \"author\": \"George Orwell\",\n        \"genre\": \"Dystopian\",\n        \"year_published\": 1949,\n        \"summary\": \"A dystopian novel set in a totalitarian society ruled by Big Brother, where truth is what the Party says it is.\",\n        \"average_rating\": 0\n    },\n    {\n        \"id\": 4,\n        \"title\": \"The Da Vinci Code\",\n        \"author\": \"Dan Brown\",\n        \"genre\": \"Thriller\",\n        \"year_published\": 2003,\n        \"summary\": \"A symbologist and a cryptologist must uncover a secret that has been protected since the time of Christ.\",\n        \"average_rating\": 0\n    },\n    {\n        \"id\": 5,\n        \"title\": \"Pride and Prejudice\",\n        \"author\": \"Jane Austen\",\n        \"genre\": \"Romance\",\n        \"year_published\": 1813,\n        \"summary\": \"A romantic novel of manners that centers on the emotional development of Elizabeth Bennet as she learns about the repercussions of hasty judgments.\",\n        \"average_rating\": 0\n    },\n    {\n        \"id\": 6,\n        \"title\": \"Dune\",\n        \"author\": \"Frank Herbert\",\n        \"genre\": \"Sci-Fi\",\n        \"year_published\": 1965,\n        \"summary\": \"A science fiction novel set in a distant future involving political intrigue and a struggle for control of the desert planet Arrakis.\",\n        \"average_rating\": 0\n    },\n    {\n        \"id\": 7,\n        \"title\": \"1984\",\n        \"author\": \"George Orwell\",\n        \"genre\": \"Dystopian\",\n        \"year_published\": 1949,\n        \"summary\": \"A dystopian novel set in a totalitarian society ruled by Big Brother.\",\n        \"average_rating\": 0\n    },\n    {\n        \"id\": 8,\n        \"title\": \"The Hobbit\",\n        \"author\": \"J.R.R. Tolkien\",\n        \"genre\": \"Fantasy\",\n        \"year_published\": 1937,\n        \"summary\": \"A home-loving hobbit embarks on an adventure to reclaim a treasure guarded by a dragon.\",\n        \"average_rating\": 0\n    },\n    {\n        \"id\": 9,\n        \"title\": \"Pride and Prejudice\",\n        \"author\": \"Jane Austen\",\n        \"genre\": \"Romance\",\n        \"year_published\": 1813,\n        \"summary\": \"A romantic novel about the emotional development of Elizabeth Bennet.\",\n        \"average_rating\": 0\n    },\n    {\n        \"id\": 10,\n        \"title\": \"The Catcher in the Rye\",\n        \"author\": \"J.D. Salinger\",\n        \"genre\": \"Literary Fiction\",\n        \"year_published\": 1951,\n        \"summary\": \"A teenage boy's journey through New York after being expelled from his prep school.\",\n        \"average_rating\": 0\n    },\n    {\n        \"id\": 11,\n        \"title\": \"To Kill a Mockingbird\",\n        \"author\": \"Harper Lee\",\n        \"genre\": \"Historical Fiction\",\n        \"year_published\": 1960,\n        \"summary\": \"A young girl in the American South experiences the realities of racism and justice.\",\n        \"average_rating\": 0\n    },\n    {\n        \"id\": 12,\n        \"title\": \"Brave New World\",\n        \"author\": \"Aldous Huxley\",\n        \"genre\": \"Dystopian\",\n        \"year_published\": 1932,\n        \"summary\": \"A dystopian novel set in a future where people are controlled through pleasure and conditioning.\",\n        \"average_rating\": 0\n    },\n    {\n        \"id\": 13,\n        \"title\": \"The Da Vinci Code\",\n        \"author\": \"Dan Brown\",\n        \"genre\": \"Thriller\",\n        \"year_published\": 2003,\n        \"summary\": \"A symbologist and cryptologist uncover secrets protected since the time of Christ.\",\n        \"average_rating\": 0\n    },\n    {\n        \"id\": 14,\n        \"title\": \"Moby-Dick\",\n        \"author\": \"Herman Melville\",\n        \"genre\": \"Adventure\",\n        \"year_published\": 1851,\n        \"summary\": \"A sea captain obsessively pursues a white whale.\",\n        \"average_rating\": 0\n    },\n    {\n        \"id\": 15,\n        \"title\": \"War and Peace\",\n        \"author\": \"Leo Tolstoy\",\n        \"genre\": \"Historical Fiction\",\n        \"year_published\": 1869,\n        \"summary\": \"A sweeping novel about the lives of five aristocratic families during the Napoleonic Wars.\",\n        \"average_rating\": 0\n    },\n    {\n        \"id\": 16,\n        \"title\": \"Crime and Punishment\",\n        \"author\": \"Fyodor Dostoevsky\",\n        \"genre\": \"Psychological Fiction\",\n        \"year_published\": 1866,\n        \"summary\": \"A psychological drama about a man who commits murder and struggles with guilt.\",\n        \"average_rating\": 0\n    },\n    {\n        \"id\": 17,\n        \"title\": \"Frankenstein\",\n        \"author\": \"Mary Shelley\",\n        \"genre\": \"Gothic Fiction\",\n        \"year_published\": 1818,\n        \"summary\": \"A scientist creates a living being, only to be horrified by the result.\",\n        \"average_rating\": 0\n    },\n    {\n        \"id\": 18,\n        \"title\": \"The Great Gatsby\",\n        \"author\": \"F. Scott Fitzgerald\",\n        \"genre\": \"Literary Fiction\",\n        \"year_published\": 1925,\n        \"summary\": \"A mysterious millionaire throws lavish parties in the hopes of reuniting with his lost love.\",\n        \"average_rating\": 0\n    },\n    {\n        \"id\": 19,\n        \"title\": \"Harry Potter and the Sorcerer\\\\'s Stone\",\n        \"author\": \"J.K. Rowling\",\n        \"genre\": \"Fantasy\",\n        \"year_published\": 1997,\n        \"summary\": \"A young boy discovers he is a wizard and attends a magical school.\",\n        \"average_rating\": 0\n    },\n    {\n        \"id\": 20,\n        \"title\": \"The Lord of the Rings\",\n        \"author\": \"J.R.R. Tolkien\",\n        \"genre\": \"Fantasy\",\n        \"year_published\": 1954,\n        \"summary\": \"A fellowship sets out on a quest to destroy a powerful ring.\",\n        \"average_rating\": 0\n    },\n    {\n        \"id\": 21,\n        \"title\": \"The Alchemist\",\n        \"author\": \"Paulo Coelho\",\n        \"genre\": \"Philosophical Fiction\",\n        \"year_published\": 1988,\n        \"summary\": \"A young shepherd sets out on a journey to find his personal legend.\",\n        \"average_rating\": 0\n    },\n    {\n        \"id\": 22,\n        \"title\": \"The Picture of Dorian Gray\",\n        \"author\": \"Oscar Wilde\",\n        \"genre\": \"Gothic Fiction\",\n        \"year_published\": 1890,\n        \"summary\": \"A young man remains youthful while his portrait ages and reveals his corruption.\",\n        \"average_rating\": 0\n    },\n    {\n        \"id\": 23,\n        \"title\": \"Dracula\",\n        \"author\": \"Bram Stoker\",\n        \"genre\": \"Horror\",\n        \"year_published\": 1897,\n        \"summary\": \"A group of people tries to stop a vampire lord from spreading his undead curse.\",\n        \"average_rating\": 0\n    },\n    {\n        \"id\": 24,\n        \"title\": \"Don Quixote\",\n        \"author\": \"Miguel de Cervantes\",\n        \"genre\": \"Adventure\",\n        \"year_published\": 1605,\n        \"summary\": \"A man becomes obsessed with chivalry and sets out to revive knighthood.\",\n        \"average_rating\": 0\n    },\n    {\n        \"id\": 25,\n        \"title\": \"The Road\",\n        \"author\": \"Cormac McCarthy\",\n        \"genre\": \"Post-Apocalyptic\",\n        \"year_published\": 2006,\n        \"summary\": \"A father and son struggle to survive in a post-apocalyptic world.\",\n        \"average_rating\": 0\n    },\n    {\n        \"id\": 26,\n        \"title\": \"Gone with the Wind\",\n        \"author\": \"Margaret Mitchell\",\n        \"genre\": \"Historical Fiction\",\n        \"year_published\": 1936,\n        \"summary\": \"A Southern woman faces hardship during the Civil War and Reconstruction.\",\n        \"average_rating\": 0\n    },\n    {\n        \"id\": 27,\n        \"title\": \"The Kite Runner\",\n        \"author\": \"Khaled Hosseini\",\n        \"genre\": \"Historical Fiction\",\n        \"year_published\": 2003,\n        \"summary\": \"A story of friendship and redemption set against the backdrop of Afghanistan political turmoil.\",\n        \"average_rating\": 0\n    },\n    {\n        \"id\": 28,\n        \"title\": \"Fahrenheit 451\",\n        \"author\": \"Ray Bradbury\",\n        \"genre\": \"Dystopian\",\n        \"year_published\": 1953,\n        \"summary\": \"A fireman becomes disillusioned with his job of burning books in a future where they are banned.\",\n        \"average_rating\": 0\n    },\n    {\n        \"id\": 29,\n        \"title\": \"The Handmaid\\\\'s Tale\",\n        \"author\": \"Margaret Atwood\",\n        \"genre\": \"Dystopian\",\n        \"year_published\": 1985,\n        \"summary\": \"In a totalitarian society, women are treated as property and forced to bear children.\",\n        \"average_rating\": 0\n    },\n    {\n        \"id\": 30,\n        \"title\": \"Slaughterhouse-Five\",\n        \"author\": \"Kurt Vonnegut\",\n        \"genre\": \"Science Fiction\",\n        \"year_published\": 1969,\n        \"summary\": \"A soldier becomes unstuck in time after surviving the bombing of Dresden.\",\n        \"average_rating\": 0\n    },\n    {\n        \"id\": 31,\n        \"title\": \"The Catch-22\",\n        \"author\": \"Joseph Heller\",\n        \"genre\": \"Satire\",\n        \"year_published\": 1961,\n        \"summary\": \"A bomber pilot in World War II tries to escape the absurdity of war and bureaucracy.\",\n        \"average_rating\": 0\n    },\n    {\n        \"id\": 32,\n        \"title\": \"The Shining\",\n        \"author\": \"Stephen King\",\n        \"genre\": \"Horror\",\n        \"year_published\": 1977,\n        \"summary\": \"A family takes care of a remote hotel, and the father becomes possessed by dark forces.\",\n        \"average_rating\": 0\n    },\n    {\n        \"id\": 33,\n        \"title\": \"Jane Eyre\",\n        \"author\": \"Charlotte Brontë\",\n        \"genre\": \"Romance\",\n        \"year_published\": 1847,\n        \"summary\": \"An orphaned girl becomes a governess and falls in love with her mysterious employer.\",\n        \"average_rating\": 0\n    },\n    {\n        \"id\": 34,\n        \"title\": \"The Grapes of Wrath\",\n        \"author\": \"John Steinbeck\",\n        \"genre\": \"Historical Fiction\",\n        \"year_published\": 1939,\n        \"summary\": \"A poor family flees the Dust Bowl in search of a better life in California.\",\n        \"average_rating\": 0\n    },\n    {\n        \"id\": 35,\n        \"title\": \"The Count of Monte Cristo\",\n        \"author\": \"Alexandre Dumas\",\n        \"genre\": \"Adventure\",\n        \"year_published\": 1844,\n        \"summary\": \"A man escapes from prison and seeks revenge on those who betrayed him.\",\n        \"average_rating\": 0\n    },\n    {\n        \"id\": 36,\n        \"title\": \"A Tale of Two Cities\",\n        \"author\": \"Charles Dickens\",\n        \"genre\": \"Historical Fiction\",\n        \"year_published\": 1859,\n        \"summary\": \"A novel about the French Revolution and the contrasting lives of two men.\",\n        \"average_rating\": 0\n    },\n    {\n        \"id\": 37,\n        \"title\": \"The Stranger\",\n        \"author\": \"Albert Camus\",\n        \"genre\": \"Philosophical Fiction\",\n        \"year_published\": 1942,\n        \"summary\": \"A man becomes detached from society after committing a senseless murder.\",\n        \"average_rating\": 0\n    },\n    {\n        \"id\": 38,\n        \"title\": \"Beloved\",\n        \"author\": \"Toni Morrison\",\n        \"genre\": \"Historical Fiction\",\n        \"year_published\": 1987,\n        \"summary\": \"A former slave is haunted by the ghost of her daughter in post-Civil War America.\",\n        \"average_rating\": 0\n    },\n    {\n        \"id\": 39,\n        \"title\": \"Lolita\",\n        \"author\": \"Vladimir Nabokov\",\n        \"genre\": \"Literary Fiction\",\n        \"year_published\": 1955,\n        \"summary\": \"A middle-aged man becomes obsessed with a twelve-year-old girl.\",\n        \"average_rating\": 0\n    },\n    {\n        \"id\": 40,\n        \"title\": \"The Name of the Wind\",\n        \"author\": \"Patrick Rothfuss\",\n        \"genre\": \"Fantasy\",\n        \"year_published\": 2007,\n        \"summary\": \"A legendary hero recounts his life story in a world of magic and mystery.\",\n        \"average_rating\": 0\n    },\n    {\n        \"id\": 41,\n        \"title\": \"The Girl with the Dragon Tattoo\",\n        \"author\": \"Stieg Larsson\",\n        \"genre\": \"Thriller\",\n        \"year_published\": 2005,\n        \"summary\": \"A journalist and a hacker investigate the disappearance of a wealthy heiress.\",\n        \"average_rating\": 0\n    },\n    {\n        \"id\": 42,\n        \"title\": \"The Hunger Games\",\n        \"author\": \"Suzanne Collins\",\n        \"genre\": \"Dystopian\",\n        \"year_published\": 2008,\n        \"summary\": \"A girl must compete in a deadly televised contest where only one person can survive.\",\n        \"average_rating\": 0\n    },\n    {\n        \"id\": 43,\n        \"title\": \"The Fault in Our Stars\",\n        \"author\": \"John Green\",\n        \"genre\": \"Romance\",\n        \"year_published\": 2012,\n        \"summary\": \"Two teenagers with terminal cancer form a life-changing bond.\",\n        \"average_rating\": 0\n    },\n    {\n        \"id\": 44,\n        \"title\": \"Ulysses\",\n        \"author\": \"James Joyce\",\n        \"genre\": \"Modernist Fiction\",\n        \"year_published\": 1922,\n        \"summary\": \"A day in the life of an ordinary man in Dublin, modeled after Homer's Odyssey.\",\n        \"average_rating\": 0\n    },\n    {\n        \"id\": 45,\n        \"title\": \"The Brothers Karamazov\",\n        \"author\": \"Fyodor Dostoevsky\",\n        \"genre\": \"Philosophical Fiction\",\n        \"year_published\": 1880,\n        \"summary\": \"A murder mystery that explores themes of faith, free will, and morality.\",\n        \"average_rating\": 0\n    },\n    {\n        \"id\": 46,\n        \"title\": \"Wuthering Heights\",\n        \"author\": \"Emily Brontë\",\n        \"genre\": \"Gothic Fiction\",\n        \"year_published\": 1847,\n        \"summary\": \"A tale of passionate love and revenge set on the Yorkshire moors.\",\n        \"average_rating\": 0\n    },\n    {\n        \"id\": 47,\n        \"title\": \"The Odyssey\",\n        \"author\": \"Homer\",\n        \"genre\": \"Epic Poetry\",\n        \"year_published\": 1847,\n        \"summary\": \"The story of Odysseus's long journey home after the Trojan War.\",\n        \"average_rating\": 0\n    },\n    {\n        \"id\": 48,\n        \"title\": \"Les Misérables\",\n        \"author\": \"Victor Hugo\",\n        \"genre\": \"Historical Fiction\",\n        \"year_published\": 1862,\n        \"summary\": \"A man seeks redemption in post-revolutionary France while being pursued by a relentless policeman.\",\n        \"average_rating\": 0\n    },\n    {\n        \"id\": 49,\n        \"title\": \"The Secret History\",\n        \"author\": \"Donna Tartt\",\n        \"genre\": \"Thriller\",\n        \"year_published\": 1992,\n        \"summary\": \"A group of elite students at a private college become involved in a murder.\",\n        \"average_rating\": 0\n    },\n    {\n        \"id\": 50,\n        \"title\": \"The Stand\",\n        \"author\": \"Stephen King\",\n        \"genre\": \"Post-Apocalyptic\",\n        \"year_published\": 1978,\n        \"summary\": \"After a plague wipes out most of the population, the survivors must choose between good and evil.\",\n        \"average_rating\": 0\n    },\n    {\n        \"id\": 51,\n        \"title\": \"Anna Karenina\",\n        \"author\": \"Leo Tolstoy\",\n        \"genre\": \"Literary Fiction\",\n        \"year_published\": 1877,\n        \"summary\": \"A tragic story of love and infidelity among the Russian aristocracy.\",\n        \"average_rating\": 0\n    },\n    {\n        \"id\": 52,\n        \"title\": \"Rebecca\",\n        \"author\": \"Daphne du Maurier\",\n        \"genre\": \"Gothic Fiction\",\n        \"year_published\": 1938,\n        \"summary\": \"A young bride is haunted by the memory of her husband's first wife.\",\n        \"average_rating\": 0\n    }\n]"
				}
			]
		},
		{
			"name": "Get a Specific Book by ID",
			"request": {
				"method": "GET",
				"header": [],
				"url": {
					"raw": "http://localhost:8000/books/1",
					"protocol": "http",
					"host": [
						"localhost"
					],
					"port": "8000",
					"path": [
						"books",
						"1"
					]
				},
				"description": "Generated from cURL: curl -X GET \"http://localhost:8000/books/1\"\n"
			},
			"response": [
				{
					"name": "Get a Specific Book by ID",
					"originalRequest": {
						"method": "GET",
						"header": [],
						"url": {
							"raw": "http://localhost:8000/books/2",
							"protocol": "http",
							"host": [
								"localhost"
							],
							"port": "8000",
							"path": [
								"books",
								"2"
							]
						}
					},
					"status": "OK",
					"code": 200,
					"_postman_previewlanguage": "json",
					"header": [
						{
							"key": "date",
							"value": "Thu, 12 Sep 2024 04:10:07 GMT"
						},
						{
							"key": "server",
							"value": "uvicorn"
						},
						{
							"key": "content-length",
							"value": "245"
						},
						{
							"key": "content-type",
							"value": "application/json"
						}
					],
					"cookie": [],
					"body": "{\n    \"id\": 2,\n    \"title\": \"The Hobbit\",\n    \"author\": \"J.R.R. Tolkien\",\n    \"genre\": \"Fantasy\",\n    \"year_published\": 1937,\n    \"summary\": \"The story follows the quest of home-loving Bilbo Baggins to win a share of the treasure guarded by Smaug the dragon.\",\n    \"average_rating\": 0\n}"
				}
			]
		},
		{
			"name": "Get All Books (skip the first 10)",
			"request": {
				"method": "GET",
				"header": [],
				"url": {
					"raw": "http://localhost:8000/books/?skip=10&limit=10",
					"protocol": "http",
					"host": [
						"localhost"
					],
					"port": "8000",
					"path": [
						"books",
						""
					],
					"query": [
						{
							"key": "skip",
							"value": "10"
						},
						{
							"key": "limit",
							"value": "10"
						}
					]
				},
				"description": "Generated from cURL: curl -X GET \"http://localhost:8000/books/?skip=10&limit=10\"\n"
			},
			"response": [
				{
					"name": "http://localhost:8000/books/?skip=10&limit=10",
					"originalRequest": {
						"method": "GET",
						"header": [],
						"url": {
							"raw": "http://localhost:8000/books/?skip=10&limit=10",
							"protocol": "http",
							"host": [
								"localhost"
							],
							"port": "8000",
							"path": [
								"books",
								""
							],
							"query": [
								{
									"key": "skip",
									"value": "10"
								},
								{
									"key": "limit",
									"value": "10"
								}
							]
						}
					},
					"status": "OK",
					"code": 200,
					"_postman_previewlanguage": "json",
					"header": [
						{
							"key": "date",
							"value": "Thu, 12 Sep 2024 04:03:46 GMT"
						},
						{
							"key": "server",
							"value": "uvicorn"
						},
						{
							"key": "content-length",
							"value": "2209"
						},
						{
							"key": "content-type",
							"value": "application/json"
						}
					],
					"cookie": [],
					"body": "[\n    {\n        \"id\": 11,\n        \"title\": \"To Kill a Mockingbird\",\n        \"author\": \"Harper Lee\",\n        \"genre\": \"Historical Fiction\",\n        \"year_published\": 1960,\n        \"summary\": \"A young girl in the American South experiences the realities of racism and justice.\",\n        \"average_rating\": 0\n    },\n    {\n        \"id\": 12,\n        \"title\": \"Brave New World\",\n        \"author\": \"Aldous Huxley\",\n        \"genre\": \"Dystopian\",\n        \"year_published\": 1932,\n        \"summary\": \"A dystopian novel set in a future where people are controlled through pleasure and conditioning.\",\n        \"average_rating\": 0\n    },\n    {\n        \"id\": 13,\n        \"title\": \"The Da Vinci Code\",\n        \"author\": \"Dan Brown\",\n        \"genre\": \"Thriller\",\n        \"year_published\": 2003,\n        \"summary\": \"A symbologist and cryptologist uncover secrets protected since the time of Christ.\",\n        \"average_rating\": 0\n    },\n    {\n        \"id\": 14,\n        \"title\": \"Moby-Dick\",\n        \"author\": \"Herman Melville\",\n        \"genre\": \"Adventure\",\n        \"year_published\": 1851,\n        \"summary\": \"A sea captain obsessively pursues a white whale.\",\n        \"average_rating\": 0\n    },\n    {\n        \"id\": 15,\n        \"title\": \"War and Peace\",\n        \"author\": \"Leo Tolstoy\",\n        \"genre\": \"Historical Fiction\",\n        \"year_published\": 1869,\n        \"summary\": \"A sweeping novel about the lives of five aristocratic families during the Napoleonic Wars.\",\n        \"average_rating\": 0\n    },\n    {\n        \"id\": 16,\n        \"title\": \"Crime and Punishment\",\n        \"author\": \"Fyodor Dostoevsky\",\n        \"genre\": \"Psychological Fiction\",\n        \"year_published\": 1866,\n        \"summary\": \"A psychological drama about a man who commits murder and struggles with guilt.\",\n        \"average_rating\": 0\n    },\n    {\n        \"id\": 17,\n        \"title\": \"Frankenstein\",\n        \"author\": \"Mary Shelley\",\n        \"genre\": \"Gothic Fiction\",\n        \"year_published\": 1818,\n        \"summary\": \"A scientist creates a living being, only to be horrified by the result.\",\n        \"average_rating\": 0\n    },\n    {\n        \"id\": 18,\n        \"title\": \"The Great Gatsby\",\n        \"author\": \"F. Scott Fitzgerald\",\n        \"genre\": \"Literary Fiction\",\n        \"year_published\": 1925,\n        \"summary\": \"A mysterious millionaire throws lavish parties in the hopes of reuniting with his lost love.\",\n        \"average_rating\": 0\n    },\n    {\n        \"id\": 19,\n        \"title\": \"Harry Potter and the Sorcerer\\\\'s Stone\",\n        \"author\": \"J.K. Rowling\",\n        \"genre\": \"Fantasy\",\n        \"year_published\": 1997,\n        \"summary\": \"A young boy discovers he is a wizard and attends a magical school.\",\n        \"average_rating\": 0\n    },\n    {\n        \"id\": 20,\n        \"title\": \"The Lord of the Rings\",\n        \"author\": \"J.R.R. Tolkien\",\n        \"genre\": \"Fantasy\",\n        \"year_published\": 1954,\n        \"summary\": \"A fellowship sets out on a quest to destroy a powerful ring.\",\n        \"average_rating\": 0\n    }\n]"
				}
			]
		},
		{
			"name": "Update Book",
			"request": {
				"method": "PUT",
				"header": [
					{
						"key": "Content-Type",
						"value": "application/json"
					}
				],
				"body": {
					"mode": "raw",
					"raw": "{\n    \"title\": \"The Catcher in the Rye\",\n    \"author\": \"J.D. Salinger\",\n    \"genre\": \"Fiction\",\n    \"year_published\": 1951,\n    \"summary\": \"The novel details two days in the life of 16-year-old Holden Caulfield after he has been expelled from prep school.\"\n}",
					"options": {
						"raw": {
							"language": "json"
						}
					}
				},
				"url": {
					"raw": "http://localhost:8000/books/1",
					"protocol": "http",
					"host": [
						"localhost"
					],
					"port": "8000",
					"path": [
						"books",
						"1"
					]
				},
				"description": "Generated from cURL: curl --location --request PUT 'http://localhost:8000/books/1' \\\n--header 'Content-Type: application/json' \\\n--data '{\n    \"title\": \"The Catcher in the Rye\",\n    \"author\": \"J.D. Salinger\",\n    \"genre\": \"Fiction\",\n    \"year_published\": 1951,\n    \"summary\": \"The novel details two days in the life of 16-year-old Holden Caulfield after he has been expelled from prep school.\"\n}'\n"
			},
			"response": [
				{
					"name": "http://localhost:8000/books/1",
					"originalRequest": {
						"method": "PUT",
						"header": [
							{
								"key": "Content-Type",
								"value": "application/json"
							}
						],
						"body": {
							"mode": "raw",
							"raw": "{\n    \"title\": \"The Catcher in the Rye\",\n    \"author\": \"J.D. Salinger\",\n    \"genre\": \"Fiction\",\n    \"year_published\": 1951,\n    \"summary\": \"The novel details two days in the life of 16-year-old Holden Caulfield after he has been expelled from prep school.\"\n}",
							"options": {
								"raw": {
									"language": "json"
								}
							}
						},
						"url": {
							"raw": "http://localhost:8000/books/1",
							"protocol": "http",
							"host": [
								"localhost"
							],
							"port": "8000",
							"path": [
								"books",
								"1"
							]
						}
					},
					"status": "OK",
					"code": 200,
					"_postman_previewlanguage": "json",
					"header": [
						{
							"key": "date",
							"value": "Thu, 12 Sep 2024 04:48:03 GMT"
						},
						{
							"key": "server",
							"value": "uvicorn"
						},
						{
							"key": "content-length",
							"value": "255"
						},
						{
							"key": "content-type",
							"value": "application/json"
						}
					],
					"cookie": [],
					"body": "{\n    \"id\": 1,\n    \"title\": \"The Catcher in the Rye\",\n    \"author\": \"J.D. Salinger\",\n    \"genre\": \"Fiction\",\n    \"year_published\": 1951,\n    \"summary\": \"The novel details two days in the life of 16-year-old Holden Caulfield after he has been expelled from prep school.\",\n    \"average_rating\": 0\n}"
				}
			]
		},
		{
			"name": "Delete a Book",
			"request": {
				"method": "DELETE",
				"header": [],
				"url": {
					"raw": "http://localhost:8000/books/1",
					"protocol": "http",
					"host": [
						"localhost"
					],
					"port": "8000",
					"path": [
						"books",
						"1"
					]
				},
				"description": "Generated from cURL: curl -X DELETE \"http://localhost:8000/books/1\"\n"
			},
			"response": [
				{
					"name": "Delete a Book",
					"originalRequest": {
						"method": "DELETE",
						"header": [
							{
								"key": "Authorization",
								"value": "Bearer eyJ0eXAiOiJKV1QiLCJhbGciOiJIUzI1NiJ9.eyJzdWIiOiJKS1RFU1QiLCJpYXQiOjE3MjYxMjAwOTgsIm5iZiI6MTcyNjEyMDA5OCwianRpIjoiMzU3YTI5OWEtMGEzZC00YjZhLThlYmYtMjE2ODY2M2U2ZGJlIiwiZXhwIjoxNzI2MTIwOTk4LCJ0eXBlIjoiYWNjZXNzIiwiZnJlc2giOmZhbHNlfQ.NBlo8QIT3ym5YicLzC0PLTSPI5PrO1MFK6w6rffwRjs",
								"type": "text"
							}
						],
						"url": {
							"raw": "http://localhost:8000/books/1",
							"protocol": "http",
							"host": [
								"localhost"
							],
							"port": "8000",
							"path": [
								"books",
								"1"
							]
						}
					},
					"status": "OK",
					"code": 200,
					"_postman_previewlanguage": "json",
					"header": [
						{
							"key": "date",
							"value": "Thu, 12 Sep 2024 05:57:34 GMT"
						},
						{
							"key": "server",
							"value": "uvicorn"
						},
						{
							"key": "content-length",
							"value": "56"
						},
						{
							"key": "content-type",
							"value": "application/json"
						}
					],
					"cookie": [],
					"body": "{\n    \"message\": \"Book and its reviews deleted successfully!\"\n}"
				}
			]
		},
		{
			"name": "Add Review",
			"request": {
				"method": "POST",
				"header": [
					{
						"key": "Content-Type",
						"value": "application/json"
					}
				],
				"body": {
					"mode": "raw",
					"raw": "{\n    \"user_id\": 123,\n    \"review_text\": \"An incredible book with deep insights into politics and humanity.\",\n    \"rating\": 5\n}",
					"options": {
						"raw": {
							"language": "json"
						}
					}
				},
				"url": {
					"raw": "http://localhost:8000/books/1/reviews",
					"protocol": "http",
					"host": [
						"localhost"
					],
					"port": "8000",
					"path": [
						"books",
						"1",
						"reviews"
					]
				},
				"description": "Generated from cURL: curl -X POST \"http://localhost:8000/books/1/reviews\" \\\n-H \"Content-Type: application/json\" \\\n-d '{\n    \"user_id\": 123,\n    \"review_text\": \"An incredible book with deep insights into politics and humanity.\",\n    \"rating\": 5\n}'\n"
			},
			"response": [
				{
					"name": "http://localhost:8000/books/1/reviews",
					"originalRequest": {
						"method": "POST",
						"header": [
							{
								"key": "Content-Type",
								"value": "application/json"
							}
						],
						"body": {
							"mode": "raw",
							"raw": "{\n    \"user_id\": 123,\n    \"review_text\": \"An incredible book with deep insights into politics and humanity.\",\n    \"rating\": 5\n}",
							"options": {
								"raw": {
									"language": "json"
								}
							}
						},
						"url": {
							"raw": "http://localhost:8000/books/1/reviews",
							"protocol": "http",
							"host": [
								"localhost"
							],
							"port": "8000",
							"path": [
								"books",
								"1",
								"reviews"
							]
						}
					},
					"status": "OK",
					"code": 200,
					"_postman_previewlanguage": "json",
					"header": [
						{
							"key": "date",
							"value": "Thu, 12 Sep 2024 04:39:51 GMT"
						},
						{
							"key": "server",
							"value": "uvicorn"
						},
						{
							"key": "content-length",
							"value": "127"
						},
						{
							"key": "content-type",
							"value": "application/json"
						}
					],
					"cookie": [],
					"body": "{\n    \"id\": 3,\n    \"book_id\": 1,\n    \"user_id\": 123,\n    \"review_text\": \"An incredible book with deep insights into politics and humanity.\",\n    \"rating\": 5\n}"
				}
			]
		},
		{
			"name": "Get Review",
			"request": {
				"method": "GET",
				"header": [],
				"url": {
					"raw": "http://localhost:8000/books/1/reviews?skip=0&limit=10",
					"protocol": "http",
					"host": [
						"localhost"
					],
					"port": "8000",
					"path": [
						"books",
						"1",
						"reviews"
					],
					"query": [
						{
							"key": "skip",
							"value": "0"
						},
						{
							"key": "limit",
							"value": "10"
						}
					]
				},
				"description": "Generated from cURL: curl -X GET \"http://localhost:8000/books/1/reviews?skip=0&limit=10\"\n"
			},
			"response": [
				{
					"name": "http://localhost:8000/books/1/reviews?skip=0&limit=10",
					"originalRequest": {
						"method": "GET",
						"header": [],
						"url": {
							"raw": "http://localhost:8000/books/1/reviews?skip=0&limit=10",
							"protocol": "http",
							"host": [
								"localhost"
							],
							"port": "8000",
							"path": [
								"books",
								"1",
								"reviews"
							],
							"query": [
								{
									"key": "skip",
									"value": "0"
								},
								{
									"key": "limit",
									"value": "10"
								}
							]
						}
					},
					"status": "OK",
					"code": 200,
					"_postman_previewlanguage": "json",
					"header": [
						{
							"key": "date",
							"value": "Thu, 12 Sep 2024 04:40:04 GMT"
						},
						{
							"key": "server",
							"value": "uvicorn"
						},
						{
							"key": "content-length",
							"value": "337"
						},
						{
							"key": "content-type",
							"value": "application/json"
						}
					],
					"cookie": [],
					"body": "[\n    {\n        \"id\": 1,\n        \"book_id\": 1,\n        \"user_id\": 123,\n        \"review_text\": \"This is a review.\",\n        \"rating\": 5\n    },\n    {\n        \"id\": 2,\n        \"book_id\": 1,\n        \"user_id\": 123,\n        \"review_text\": \"An incredible book with deep insights into politics and humanity.\",\n        \"rating\": 5\n    },\n    {\n        \"id\": 3,\n        \"book_id\": 1,\n        \"user_id\": 123,\n        \"review_text\": \"An incredible book with deep insights into politics and humanity.\",\n        \"rating\": 5\n    }\n]"
				}
			]
		},
		{
			"name": "Generate Summary",
			"request": {
				"method": "POST",
				"header": [
					{
						"key": "Content-Type",
						"value": "application/json"
					}
				],
				"body": {
					"mode": "raw",
					"raw": "{\n    \"content\": \"This book is a gripping tale of adventure and self-discovery.\"\n}",
					"options": {
						"raw": {
							"language": "json"
						}
					}
				},
				"url": {
					"raw": "http://localhost:8000/generate-summary/",
					"protocol": "http",
					"host": [
						"localhost"
					],
					"port": "8000",
					"path": [
						"generate-summary",
						""
					]
				},
				"description": "Generated from cURL: curl -X POST \"http://localhost:8000/generate-summary/\" \\\n-H \"Content-Type: application/json\" \\\n-d '{\n    \"content\": \"This book is a gripping tale of adventure and self-discovery.\"\n}'\n"
			},
			"response": [
				{
					"name": "http://localhost:8000/generate-summary/",
					"originalRequest": {
						"method": "POST",
						"header": [
							{
								"key": "Content-Type",
								"value": "application/json"
							}
						],
						"body": {
							"mode": "raw",
							"raw": "{\n    \"content\": \"This book is a gripping tale of adventure and self-discovery.\"\n}",
							"options": {
								"raw": {
									"language": "json"
								}
							}
						},
						"url": {
							"raw": "http://localhost:8000/generate-summary/",
							"protocol": "http",
							"host": [
								"localhost"
							],
							"port": "8000",
							"path": [
								"generate-summary",
								""
							]
						}
					},
					"status": "OK",
					"code": 200,
					"_postman_previewlanguage": "json",
					"header": [
						{
							"key": "date",
							"value": "Thu, 12 Sep 2024 04:41:22 GMT"
						},
						{
							"key": "server",
							"value": "uvicorn"
						},
						{
							"key": "content-length",
							"value": "95"
						},
						{
							"key": "content-type",
							"value": "application/json"
						}
					],
					"cookie": [],
					"body": "{\n    \"summary\": \"Llama3 summary of the book: This book is a gripping tale of adventure and self...\"\n}"
				}
			]
		},
		{
			"name": "Book Recommendations",
			"request": {
				"method": "GET",
				"header": [],
				"url": {
					"raw": "http://localhost:8000/recommendations/?book_title=Dune",
					"protocol": "http",
					"host": [
						"localhost"
					],
					"port": "8000",
					"path": [
						"recommendations",
						""
					],
					"query": [
						{
							"key": "book_title",
							"value": "Dune"
						}
					]
				},
				"description": "Generated from cURL: curl -X GET \"http://localhost:8000/recommendations/?book_title=Dune\"\n"
			},
			"response": [
				{
					"name": "http://localhost:8000/recommendations/?book_title=Dune",
					"originalRequest": {
						"method": "GET",
						"header": [],
						"url": {
							"raw": "http://localhost:8000/recommendations/?book_title=Dune",
							"protocol": "http",
							"host": [
								"localhost"
							],
							"port": "8000",
							"path": [
								"recommendations",
								""
							],
							"query": [
								{
									"key": "book_title",
									"value": "Dune"
								}
							]
						}
					},
					"status": "OK",
					"code": 200,
					"_postman_previewlanguage": "json",
					"header": [
						{
							"key": "date",
							"value": "Thu, 12 Sep 2024 04:42:51 GMT"
						},
						{
							"key": "server",
							"value": "uvicorn"
						},
						{
							"key": "content-length",
							"value": "118"
						},
						{
							"key": "content-type",
							"value": "application/json"
						}
					],
					"cookie": [],
					"body": "[\n    {\n        \"title\": \"Dune\",\n        \"genre\": \"Sci-Fi\",\n        \"average_rating\": 0\n    },\n    {\n        \"title\": \"The Hobbit\",\n        \"genre\": \"Fantasy\",\n        \"average_rating\": 0\n    }\n]"
				}
			]
		}
	]
}